{
  "$schema": "https://json-schema.org/draft/2020-12/schema",
  "$id": "https://rae.local/contracts/workflows/workflow-v2.1.schema.json",
  "title": "RAE graph-native workflow v2.1",
  "type": "object",
  "additionalProperties": false,
  "required": ["schema_version", "workflow_id", "revision", "entry_node", "terminal_node", "nodes", "edges"],
  "properties": {
    "schema_version": { "const": "2.1.0" },
    "workflow_id": { "type": "string", "pattern": "^[a-z][a-z0-9-]{2,63}$" },
    "revision": { "type": "integer", "minimum": 1 },
    "title": { "type": "string", "minLength": 1, "maxLength": 160 },
    "entry_node": { "$ref": "#/$defs/nodeId" },
    "terminal_node": { "$ref": "#/$defs/nodeId" },
    "nodes": { "type": "array", "minItems": 2, "maxItems": 64, "items": { "$ref": "#/$defs/node" } },
    "edges": { "type": "array", "minItems": 1, "maxItems": 256, "items": { "$ref": "#/$defs/edge" } },
    "payload_contracts": { "type": "object", "maxProperties": 64, "additionalProperties": { "type": "object" } },
    "budgets": {
      "type": "object", "additionalProperties": false,
      "properties": {
        "max_concurrency": { "type": "integer", "minimum": 1, "maximum": 4 },
        "max_repair_rounds": { "type": "integer", "minimum": 0, "maximum": 5 },
        "max_attempts_per_node": { "type": "integer", "minimum": 1, "maximum": 3 },
        "max_dynamic_instances": { "type": "integer", "minimum": 1, "maximum": 128 },
        "max_pipeline_depth": { "type": "integer", "minimum": 1, "maximum": 4 },
        "max_map_items": { "type": "integer", "minimum": 1, "maximum": 32 }
      }
    }
  },
  "$defs": {
    "nodeId": { "type": "string", "pattern": "^[a-z][a-z0-9._-]{0,63}$" },
    "pointer": { "type": "string", "pattern": "^(|/(?:[^~/]|~[01])*)$", "maxLength": 512 },
    "failure": {
      "type": "object", "additionalProperties": false, "required": ["mode"],
      "properties": {
        "mode": { "enum": ["fail-workflow", "collect"] },
        "max_failures": { "type": "integer", "minimum": 0, "maximum": 31 },
        "minimum_successes": { "type": "integer", "minimum": 1, "maximum": 32 }
      }
    },
    "map": {
      "type": "object", "additionalProperties": false,
      "required": ["source_pointer", "stable_key_pointer"],
      "properties": {
        "source_pointer": { "$ref": "#/$defs/pointer" },
        "stable_key_pointer": { "$ref": "#/$defs/pointer" },
        "max_items": { "type": "integer", "minimum": 1, "maximum": 32 }
      }
    },
    "transform": {
      "type": "object", "additionalProperties": false, "required": ["operation"],
      "properties": {
        "operation": { "enum": ["select", "flatten", "deduplicate", "sort", "limit", "group", "cartesian"] },
        "source_pointer": { "$ref": "#/$defs/pointer" },
        "value_pointer": { "$ref": "#/$defs/pointer" },
        "key_pointer": { "$ref": "#/$defs/pointer" },
        "pointers": { "type": "array", "minItems": 2, "maxItems": 4, "uniqueItems": true, "items": { "$ref": "#/$defs/pointer" } },
        "limit": { "type": "integer", "minimum": 1, "maximum": 128 },
        "descending": { "type": "boolean" }
      }
    },
    "quorum": {
      "type": "object", "additionalProperties": false, "required": ["threshold"],
      "properties": {
        "threshold": { "type": "integer", "minimum": 1, "maximum": 64 },
        "groups": {
          "type": "array", "minItems": 1, "maxItems": 16,
          "items": {
            "type": "object", "additionalProperties": false, "required": ["id", "members", "threshold"],
            "properties": {
              "id": { "type": "string", "pattern": "^[a-z][a-z0-9-]{0,31}$" },
              "members": { "type": "array", "minItems": 1, "maxItems": 32, "uniqueItems": true, "items": { "$ref": "#/$defs/nodeId" } },
              "threshold": { "type": "integer", "minimum": 1, "maximum": 32 }
            }
          }
        }
      }
    },
    "loop": {
      "type": "object", "additionalProperties": false, "required": ["max_iterations", "members"],
      "properties": {
        "mode": { "enum": ["bounded", "until-dry"] },
        "max_iterations": { "type": "integer", "minimum": 1, "maximum": 5 },
        "members": { "type": "array", "minItems": 1, "maxItems": 32, "uniqueItems": true, "items": { "$ref": "#/$defs/nodeId" } },
        "source_pointer": { "$ref": "#/$defs/pointer" },
        "stable_key_pointer": { "$ref": "#/$defs/pointer" }
      }
    },
    "node": {
      "type": "object", "additionalProperties": false, "required": ["id", "kind", "access", "guidance"],
      "properties": {
        "id": { "$ref": "#/$defs/nodeId" },
        "kind": { "enum": ["agent", "map", "transform", "join", "gate", "checkpoint", "loop", "terminal"] },
        "access": { "enum": ["read", "write", "control"] },
        "guidance": { "type": "string", "minLength": 1, "maxLength": 12000 },
        "role": { "type": "string", "maxLength": 128 },
        "payload_contract": { "type": "string", "pattern": "^[A-Za-z][A-Za-z0-9._-]{0,63}$" },
        "tier": { "enum": ["economy", "standard", "judgment"] },
        "join": { "enum": ["all", "any", "quorum"] },
        "quorum": { "$ref": "#/$defs/quorum" },
        "map": { "$ref": "#/$defs/map" },
        "transform": { "$ref": "#/$defs/transform" },
        "failure_handling": { "$ref": "#/$defs/failure" },
        "resource": { "type": "string", "maxLength": 128 },
        "ownership_plan": { "type": "boolean" },
        "mutation_checkpoint": { "type": "boolean" },
        "verification": { "type": "boolean" },
        "loop": { "$ref": "#/$defs/loop" }
      }
    },
    "edge": {
      "type": "object", "additionalProperties": false, "required": ["from", "to", "type"],
      "properties": {
        "from": { "$ref": "#/$defs/nodeId" },
        "to": { "$ref": "#/$defs/nodeId" },
        "type": { "enum": ["sequence", "artifact", "stream", "condition", "loop-back"] },
        "artifact": { "type": "string", "maxLength": 128 },
        "condition": { "enum": ["success", "failure", "blocking-findings", "budget-available"] }
      }
    }
  }
}
